video_id,trending_date,title,channel_title,category_id,publish_time,tags,views,likes,dislikes,comment_count,thumbnail_link,comments_disabled,ratings_disabled,video_error_or_removed,description 
q5bPa-Ne5BA,,Seinfeld&#39;s Jason Alexander on Jerry Seinfeld&#39;s Comedians in Cars Getting Coffee,hudsonunionsociety,,2017-12-18T03:54:47Z,,,,,,,,,,"The Hudson Union www.hudsonunionsociety.com is where everyone comes to be inspired, to change our world. Check us out on Twitter @ActualJoePascal ..."
zt92TgCON1o,,Iron Maiden&#39;s Bruce Dickinson on Meeting Rod Smallwood,hudsonunionsociety,,2017-12-02T02:46:43Z,,,,,,,,,,"The Hudson Union www.hudsonunionsociety.com is where everyone comes to be inspired, to change our world. Check us out on Twitter @ActualJoePascal ..."
p7PdxBKW5WA,,The Office&#39;s Jenna Fischer on Her Worst Experience as a Struggling Actress,hudsonunionsociety,,2017-11-17T03:52:08Z,,,,,,,,,,"The Hudson Union www.hudsonunionsociety.com is where everyone comes to be inspired, to change our world. Check us out on Twitter @ActualJoePascal For ..."
WgIlcHlNiRA,,Iron Maiden&#39;s Bruce Dickinson Talks about the Band&#39;s Success,hudsonunionsociety,,2017-12-02T02:46:44Z,,,,,,,,,,"The Hudson Union www.hudsonunionsociety.com is where everyone comes to be inspired, to change our world. Check us out on Twitter @ActualJoePascal ..."
NlzSDaKvbs4,,Iron Maiden&#39;s Bruce Dickinson Talks About his Time as a Professional Airline Pilot,hudsonunionsociety,,2017-12-02T02:46:43Z,,,,,,,,,,"The Hudson Union www.hudsonunionsociety.com is where everyone comes to be inspired, to change our world. Check us out on Twitter @ActualJoePascal ..."
5KU1NK9GPts,,Seinfeld&#39;s Jason Alexander on His Favorite Episode,hudsonunionsociety,,2017-12-18T03:54:47Z,,,,,,,,,,"The Hudson Union www.hudsonunionsociety.com is where everyone comes to be inspired, to change our world. Check us out on Twitter @ActualJoePascal ..."
tL-VkV5fYNA,,Seinfeld&#39;s Jason Alexander on Working with Martin Short in The Producers,hudsonunionsociety,,2017-12-18T03:54:46Z,,,,,,,,,,"The Hudson Union www.hudsonunionsociety.com is where everyone comes to be inspired, to change our world. Check us out on Twitter @ActualJoePascal ..."
Wyher2U4MtA,,Seinfeld&#39;s Jason Alexander on the Chinese Restaurant Episode,hudsonunionsociety,,2017-12-18T03:54:46Z,,,,,,,,,,"The Hudson Union www.hudsonunionsociety.com is where everyone comes to be inspired, to change our world. Check us out on Twitter @ActualJoePascal ..."
Nf43zys8wEQ,,Iron Maiden&#39;s Bruce Dickinson on Becoming a Fencing Teacher,hudsonunionsociety,,2017-12-02T02:46:44Z,,,,,,,,,,"The Hudson Union www.hudsonunionsociety.com is where everyone comes to be inspired, to change our world. Check us out on Twitter @ActualJoePascal ..."
2uSxRVJFBpI,,The Office&#39;s Jenna Fischer on Getting her Role on The Office,hudsonunionsociety,,2017-11-17T03:52:09Z,,,,,,,,,,"The Hudson Union www.hudsonunionsociety.com is where everyone comes to be inspired, to change our world. Check us out on Twitter @ActualJoePascal For ..."
w8VHZAeItno,,&#39;The Walking Dead&#39;  Andrew Lincoln serenades Chandler Riggs,BowlFullofAwesome,,2018-02-23T17:08:17Z,,,,,,,,,,"via EW.com published Feb 23, 2018- All content belongs to respective owners."
PQX8Amp_d5Q,,TWD 811 Opening Minutes,BowlFullofAwesome,,2018-03-05T03:59:27Z,,,,,,,,,,Special Thanks to The Spoil'd Rotten Walking Dead Fans FB (used with permission)
JZyOr2VgPbY,,FTWD 403 Clip Morgan Puts Nick in His Place,BowlFullofAwesome,,2018-04-27T17:26:24Z,,,,,,,,,,via IGN.
lM5mIi0n5ic,,TWD Exclusive: Rick and Michonne Say Farewell to Alexandria via TVGuide,BowlFullofAwesome,,2018-03-01T18:10:41Z,,,,,,,,,,"In this exclusive clip, Rick and Michonne are preparing to take their leave of a place where not all their memories are painful ones — their romantic relationship ..."
SnQGqbecGKg,,Danai Gurira On Carl&#39;s Death: &#39;I Found Michonne When I Worked With Chandler [Riggs],BowlFullofAwesome,,2018-03-03T00:21:36Z,,,,,,,,,,'The Walking Dead' Danai Gurira On Carl's Death: 'I Found Michonne When I Worked With Chandler [Riggs]' via Access Online.
23Z0nYsR-cw,,FTWD 3X01 Deleted Scene via IGN,BowlFullofAwesome,,2018-03-13T00:48:14Z,,,,,,,,,,"Revisit the Season 3 premiere of Fear the Walking Dead with this exclusive deleted scene from the Blu-ray release, on sale March 13 in the US and Canada."
LQdVZLjsXNg,,8X12 Exclusive &#39;Walking Dead&#39; Scene via EW.com,BowlFullofAwesome,,2018-03-15T16:08:39Z,,,,,,,,,,"An exclusive scene from the next Walking Dead episode, and it's a key one as Rick and Daryl share an important graveyard scene together where they discuss ..."
kR2Sp53Y_uc,,Colman Domingo via IG (@kingofbingo),BowlFullofAwesome,,2018-03-18T18:42:31Z,,,,,,,,,,
lqtIjsB2JQc,,TWD Season 8B Kingdom First Look via AMC TWD Twitter,BowlFullofAwesome,,2018-02-16T23:38:15Z,,,,,,,,,,
T6JPR_IE5c8,,Katelyn says goodbye to Chandler,BowlFullofAwesome,,2018-02-24T15:11:02Z,,,,,,,,,,
aRPfJM4Relg,,Moe Confronts Alex &amp; Donna About the Hookup | Black Ink Crew,VH1,,2018-05-06T02:00:01Z,,,,,,,,,,Moe doesn't hold back when he shows up at the Miami house to confront Alex and Donna about their hookup. #BlackInkCrew #VH1 Subscribe to VH1: ...
_uG7uj7so8c,,Martha Stewart Wonders Why Post Malone Came To Dinner | Martha &amp; Snoop&#39;s Potluck Dinner Party,VH1,,2017-11-19T13:00:01Z,,,,,,,,,,"During a game of “Two Truths and a Lie” with Wendy Williams and Post Malone, Martha Stewart and Snoop Dogg joke about Post Malone's career."
GUCGj96FCQo,,Tamar Braxton Confronts DeRay Davis | Hip Hop Squares,VH1,,2018-04-25T10:00:03Z,,,,,,,,,,Tamar Braxton comes for DeRay after he accuses her of lip-syncing. #VH1 #HipHopSquares Subscribe to VH1: http://on.vh1.com/subscribe Connect with VH1 ...
1o2Vog7NcmQ,,Daddy Iman Shumpert&#39;s Salon Time w/ Junie | Teyana &amp; Iman,VH1,,2018-04-06T10:00:00Z,,,,,,,,,,"After Teyana agrees to learn how to swim for Junie, it's Iman's turn to learn how to do Junie's hair. #TeyanaAndIman #VH1 Subscribe to VH1: ..."
iwM3oS7CRhA,,Teyana Taylor &amp; Iman Shumpert&#39;s Romantic Dinner | Teyana &amp; Iman,VH1,,2018-05-04T10:00:11Z,,,,,,,,,,"Teyana and Iman go out for dinner before Iman hits the road for basketball season, and talk about their loving relationship. #TeyanaAndIman #VH1 Subscribe to ..."
UzCb00tGOmw,,The Crew Crashes Sky&#39;s Vacation | Black Ink Crew,VH1,,2018-05-02T10:00:07Z,,,,,,,,,,Ceaser makes a drastic miscalculation in taking the rest of the crew down to Miami to surprise Sky on her solo vacation. #BlackInkCrew #VH1 Subscribe to VH1: ...
2GWvosFbkbw,,Teyana &amp; Iman Debate Harlem vs. Chicago Style | Teyana &amp; Iman,VH1,,2018-04-02T10:00:00Z,,,,,,,,,,Teyana and Iman rep for their respective hometowns of Harlem and Chicago while debating the proper way to wear a durag. #TeyanaAndIman #VH1 Subscribe ...
4hrrK3rXrR0,,Iman Shumpert On Falling In Love w/ Teyana Taylor | How We Met | Teyana &amp; Iman,VH1,,2018-03-20T15:00:02Z,,,,,,,,,,"Iman Shumpert tells the story of how he met and fell for Teyana Taylor, and how they eventually made baby Junie. #TeyanaAndIman #VH1 Subscribe to VH1: ..."
Y5BZBRLDVu4,,Tiffany Haddish &amp; Black Ink Crew’s Sky Share A Phallic Doughnut | Hip Hop Squares,VH1,,2018-04-24T10:00:05Z,,,,,,,,,,"Teyana Taylor is mad she isn't given a doughnut, while Tiffany Haddish and Sky share the dick-and-balls doughnut that was given to Michael Blackson. Watch ..."
0SNNMrcTHQE,,Unseen Footage: Sky Crashes Dutchess &amp; Ceaser’s Break Up ‘Sneak Peek’ | Black Ink Crew,VH1,,2018-02-07T11:00:00Z,,,,,,,,,,Sky ruins Dutchess & Ceaser's final moment when she lashes out at production because she's hungry. See more unseen footage in the 'Behind The Ink: Turnt ...
D7JorwX31CQ,,The Killers - Rut,TheKillersVEVO,,2018-01-10T05:00:00Z,,,,,,,,,,Executive Producer: Britte Sappington Producer/Director: Danny Drysdale Eight Little Crickets Music video by The Killers performing Rut. (C) 2018 Island ...
_d3hFgit18I,,The Killers - Run For Cover (Naderi Remix / Audio),TheKillersVEVO,,2018-01-19T05:00:03Z,,,,,,,,,,"Music video by The Killers performing Run For Cover. (C) 2018 Island Records, a division of UMG Recordings, Inc. http://vevo.ly/1fsMWl Subscribe: ..."
rz4Dd1I_fX0,,The Periodic Table Song (2018 Update!) | SCIENCE SONGS,AsapSCIENCE,,2018-02-06T19:00:02Z,,,,,,,,,,"SNAPCHAT 'whalewatchmeplz' and 'pixelmitch' Send us stuff! ASAPSCIENCE INC. P.O. Box 93, Toronto P Toronto, ON, M5S2S6 ..."
BRDApYgvDqQ,,LAB RULES - Dua Lipa &quot;New Rules&quot; Parody | SCIENCE SONGS,AsapSCIENCE,,2018-04-17T16:43:33Z,,,,,,,,,,"Created by: Mitchell Moffit and Gregory Brown Written by: Mitchell Moffit, Gregory Brown, Rachel Salt Filmed by: Sel Grebrehiwot Music and Editing: Mitchell ..."
qS6LoRYUdhw,,What Is The Most Dangerous Drug In The World? ft. In A Nutshell (Kurzgesagt),AsapSCIENCE,,2017-11-16T17:38:54Z,,,,,,,,,,"Follow us @whalewatchmeplz & @mitchellmoffit Written by Rachel Salt, Gregory Brown and Mitchell Moffit GET THE ASAPSCIENCE BOOK: ..."
K2V7YQhsFo4,,What Happens When You Take Steroids?,AsapSCIENCE,,2018-04-19T16:00:03Z,,,,,,,,,,"Created by: Mitchell Moffit and Gregory Brown Written by: Jodre Datu, Rachel Salt, Greg Brown, & Mitch Moffit Illustrated by: Max Simmons Edited by: Sel ..."
rrwd2_UkmNw,,How To Break Your Bad Habit,AsapSCIENCE,,2018-03-27T17:00:08Z,,,,,,,,,,"Created by: Mitchell Moffit and Gregory Brown Written by: Rachel Salt, Greg Brown & Mitch Moffit Illustrated by: Max Simmons Edited by: Sel Ghebrehiwot ..."
TEWLY3mdk8E,,How Can You Change Somebody&#39;s Opinion?,AsapSCIENCE,,2017-11-23T17:16:09Z,,,,,,,,,,Hope these tips to win an argument are helpful! Created by: Mitchell Moffit and Gregory Brown Written by: Mitchell Moffit Illustrated by: Max Simmons Edited by: ...
71X7a8eu73k,,Mom vs. Dad: What Did You Inherit?,AsapSCIENCE,,2018-04-05T16:00:01Z,,,,,,,,,,"Created by: Mitchell Moffit and Gregory Brown Written by: Amanda Edward, Rachel Salt, Greg Brown & Mitch Moffit Illustrated by: Max Simmons Edited by: Sel ..."
b03U6BYF9L0,,Debunking Anti-Vaxxers,AsapSCIENCE,,2018-02-15T17:09:04Z,,,,,,,,,,"Created by: Mitchell Moffit and Gregory Brown Written by: Amanda Edwards, Annik Carson, Rachel Salt, Greg Brown, & Mitch Moffit Illustrated by: Max Simmons ..."
eEDZuFw34YM,,What If Your Airplane Door Burst Open Mid-Flight?,AsapSCIENCE,,2018-01-25T17:00:04Z,,,,,,,,,,"Created by: Mitchell Moffit and Gregory Brown Written by: Amanda Edward, Rachel Salt, Greg Brown & Mitch Moffit Illustrated by: Max Simmons Edited by: Sel ..."
4bzWwbjYi0c,,The 11 Greatest Threats To Humanity,AsapSCIENCE,,2017-12-07T19:00:01Z,,,,,,,,,,Created by: Mitchell Moffit and Gregory Brown Written by: Rachel Salt and Mitchell Moffit Illustrated by: Max Simmons Edited by: Sel Ghebrehiwot & Mitchell ...
zH8NxTlzw7w,,Neil Young + Promise Of The Real - Peace Trail (Official Music Video From the Film &#39;Paradox&#39;),neilyoungchannel,,2018-03-30T22:36:10Z,,,,,,,,,,"Official Music Video for ""Peace Trail"" from Neil Young + Promise of The Real from the Motion Picture 'Paradox' Get the soundtrack at https://nyoung.me/paradox ..."
tfyNPxM-M-w,,Neil Young + Promise of The Real - Already Great (Official Music Video),neilyoungchannel,,2017-12-01T16:00:01Z,,,,,,,,,,Follow Neil Young: http://www.Facebook.com/NeilYoung http;//www.Twitter.com/NeilYoung http;//www.Instagram.com/NeilYoung http://www.
_YIB0W6z2NA,,Neil Young + Promise Of The Real - Almost Always (Official Music Video),neilyoungchannel,,2018-02-01T14:59:42Z,,,,,,,,,,Director: Daryl Hannah Producer: Gary Ward Follow Neil Young: http://www.Facebook.com/NeilYoung http://www.Twitter.com/NeilYoung http://www.
LqBTw_fye1c,,New Hall of Presidents with Donald Trump - FULL SHOW,wdwmagic,,2017-12-19T01:20:53Z,,,,,,,,,,"Video by http://www.wdwmagic.com. The new Hall of Presidents, with Donald Trump. Full Show."
AH4xY3bv7Pw,,Slinky Dog Dash Coaster test rides,wdwmagic,,2018-02-16T19:33:10Z,,,,,,,,,,Slinky Dog Dash coaster testing in the upcoming Toy Story Land at Disney's Hollywood Studios.
iGbP-nsf_Qo,,The American Adventure updated Golden Dream finale 2018,wdwmagic,,2018-02-14T19:51:02Z,,,,,,,,,,Video by http://www.wdwmagic.com. See the new updated 2018 finale of The American Adventure at Epcot.
ACNEuDdzVhM,,Reflections of Earth with Peace on Earth 2017,wdwmagic,,2017-11-25T15:01:43Z,,,,,,,,,,Video by http://www.wdwmagic.com. Reflections of Earth with Peace on Earth finale 2017. Part of Epcot's International Festival of the Holidays.
yET8w1vhGJ8,,Edna Mode at the Incredible Tomorrowland Expo,wdwmagic,,2018-05-25T19:09:42Z,,,,,,,,,,Video by http://www.wdwmagic.com.
HHCs7FEmXzA,,Disney’s Animal Kingdom 20th Anniversary Celebration,wdwmagic,,2018-04-22T19:42:05Z,,,,,,,,,,
HTpVRdtfa08,,Guardians of the Galaxy Awesome Mix Live!,wdwmagic,,2018-06-09T18:29:09Z,,,,,,,,,,Video by http://www.wdwmagic.com. The very first performance of Guardians of the Galaxy Awesome Mix Live! at Epcot.
3H9AmktXD0c,,Meet Augustus the Baby Hippo,wdwmagic,,2018-02-22T00:25:40Z,,,,,,,,,,"Meet Augustus, the Baby Hippo born at Disney's Animal Kingdom."
BOKOPp-510s,,Incredible Tomorrowland Expo Jack Jack Diaper Dash,wdwmagic,,2018-05-25T16:57:25Z,,,,,,,,,,Video bu http://www.wdwmagic.com. The Diaper Dash in the Magic Kingdom's Tomorrowland.
BkB6982fdXE,,Incredible Tomorrowland Expo Dance Party,wdwmagic,,2018-05-31T18:01:34Z,,,,,,,,,,Video by http://www.wdwmagic.com.
oSZDe6CrfN4,,Chloe x Halle - Warrior (from A Wrinkle in Time) (Official Music Video),ChloexHalleVEVO,,2018-03-08T02:30:01Z,,,,,,,,,,------ Follow Chloe x Halle: http://chloexhalle.com http://twitter.com/chloexhalle http://facebook.com/chloexhalle http://instagram.com/chloexhalle ChloexHalle ...
TznpmCs1ghg,,Chloe x Halle - The Kids Are Alright (Audio),ChloexHalleVEVO,,2018-01-03T05:01:00Z,,,,,,,,,,------ Follow Chloe x Halle: http://chloexhalle.com http://twitter.com/chloexhalle http://facebook.com/chloexhalle http://instagram.com/chloexhalle.
RkWGAV609wk,,Chloe x Halle - Warrior (Chloe x Halle live on the Honda Stage at iHeartRadio New York),ChloexHalleVEVO,,2018-04-30T16:00:03Z,,,,,,,,,,Warrior” by Chloe x Halle live on the Honda Stage iHeartRadio New York Chloe x Halle's debut album 'The Kids Are Alright 'is available now: ...
nCGwrkSd89o,,Chloe x Halle - The Kids Are Alright (Chloe x Halle live on the Honda Stage at iHeartRa...,ChloexHalleVEVO,,2018-04-30T16:00:04Z,,,,,,,,,,The Kids Are Alright” by Chloe x Halle live on the Honda Stage iHeartRadio New York Chloe x Halle's debut album 'The Kids Are Alright 'is available now: ...
rHUEthVnCj8,,Chloe x Halle - Grown (Chloe x Halle live on the Honda Stage at iHeartRadio New York),ChloexHalleVEVO,,2018-04-30T16:00:06Z,,,,,,,,,,Grown” by Chloe x Halle live on the Honda Stage iHeartRadio New York Chloe x Halle's debut album 'The Kids Are Alright 'is available now: ...
IeTTfquV0iE,,Chloe x Halle - I Say So (Audio),ChloexHalleVEVO,,2017-11-17T05:00:00Z,,,,,,,,,,------ Subscribe!!! Follow Chloe x Halle! Official Website: http://chloeandhalle.com Twitter: http://twitter.com/chloeandhalle Facebook: ...
Rn3wznA1RlQ,,Chloe x Halle - The Kids Are Alright Film,ChloexHalleVEVO,,2018-03-23T04:01:00Z,,,,,,,,,,------ Follow Chloe x Halle: http://chloexhalle.com http://twitter.com/chloexhalle http://facebook.com/chloexhalle http://instagram.com/chloexhalle.
DyYtiH5ggg4,,Chloe x Halle - &quot;Baby On a Plane&quot; &amp; &quot;If God Spoke&quot; (Behind The Songs),ChloexHalleVEVO,,2018-04-09T14:00:03Z,,,,,,,,,,------ Follow Chloe x Halle: http://chloexhalle.com http://twitter.com/chloexhalle http://facebook.com/chloexhalle http://instagram.com/chloexhalle.
3rGpNFyww_E,,Chloe x Halle - &quot;Drop&quot; &amp; &quot;Fall&quot; (Behind The Songs),ChloexHalleVEVO,,2018-04-12T14:00:00Z,,,,,,,,,,------ Follow Chloe x Halle: http://chloexhalle.com http://twitter.com/chloexhalle http://facebook.com/chloexhalle http://instagram.com/chloexhalle.
bcPhkm1XmB0,,"Chloe x Halle - &quot;Grown,&quot; &quot;The Kids Are Alright&quot; &amp; &quot;Warrior&quot; (Behind The Songs)",ChloexHalleVEVO,,2018-03-23T14:00:03Z,,,,,,,,,,------ Follow Chloe x Halle: http://chloexhalle.com http://twitter.com/chloexhalle http://facebook.com/chloexhalle http://instagram.com/chloexhalle.
lQegMA_kY9Y,,Balcony Conversations - Bitcoin Guy,LifeAccordingToJimmy,,2018-01-23T01:59:31Z,,,,,,,,,,Jimmy gets way into bitcoin. SUBSCRIBE: http://bit.ly/LifeAccordingToJimmy Video by: Jimmy Tatro: https://www.instagram.com/jimmy/ Christian Pierce: ...
IywiodrtyfM,,Another Holiday Commercial,LifeAccordingToJimmy,,2017-12-19T00:18:32Z,,,,,,,,,,Written by: Jimmy Tatro and Christian Pierce Directed by: Jimmy Tatro DP: Neema Sadeghi 1st AC: Michael Nicholas Gaffer: Eric Vera Edited by: Kyle Herbert ...
C6Y25qvWu6I,,Thanksgiving Grace,LifeAccordingToJimmy,,2017-11-28T19:42:44Z,,,,,,,,,,Written by: Jimmy Tatro and Christian Pierce Shot by: George Neinhuis Kyle Herbert: https://www.instagram.com/instakyle/ Audio: Tad Chamberlain Edited by: ...
39D4ZfTKgk8,,Parental Advisory,LifeAccordingToJimmy,,2018-01-11T00:29:04Z,,,,,,,,,,Written by: Jimmy Tatro and Christian Pierce Directed by: Jimmy Tatro and Christian Pierce Edited by: Jimmy Tatro Camera: Kyle Herbert ...
pTvwoS07nJY,,Balcony Conversations - Male Rompers,LifeAccordingToJimmy,,2017-12-11T20:12:23Z,,,,,,,,,,Edited by: Jimmy Tatro.
fYksRqeA9QI,,Jimmy Breaks Down His Blown Comeback,LifeAccordingToJimmy,,2017-11-21T01:28:08Z,,,,,,,,,,Special thanks: Elly Geroulis Kyle Herbert Christian Pierce Felipe Favela Brian Zaghi Mike Attanasio Shot by: Kyle Herbert: https://www.instagram.com/instakyle/ ...
oNWScLy3Dus,,BURKINSOX INFOMERCIAL,LifeAccordingToJimmy,,2017-12-05T01:26:45Z,,,,,,,,,,Edited by: Jimmy Tatro.
4kKUpmXDE6Q,,U2: Live in der Berliner U-Bahnlinie U2: „One“ – Bono überrascht die Fahrgäste,rollingstoneonline,,2017-12-06T14:55:11Z,,,,,,,,,,
Od-iIgoZXrg,,R.E.M. im Rolling Stone Talk,rollingstoneonline,,2017-11-20T11:43:18Z,,,,,,,,,,"Nach vier Demos wollte ich mich vor einen fahrenden Laster werfen“, so beschreibt der ehemalige R.E.M.-Sänger Michael Stipe den Auswahlprozess der ..."
KCrkw7V7CPU,,U2: Live in der Berliner U-Bahnlinie U2,rollingstoneonline,,2017-12-07T09:04:41Z,,,,,,,,,,"Die irische Band U2 spielte ihre Hits „Get Out Of Your Own Way“, „Sunday Bloody Sunday“ und „One“ in der Berliner Ubahnstation „Deutsche Oper“ der Linie U2 ..."
VKY5Ws1Ys1w,,"U2: Live in der Berliner U-Bahnlinie U2: „Get Out Of Your Own Way“, „Sunday Bloody Sunday“ und „One“",rollingstoneonline,,2017-12-06T14:56:11Z,,,,,,,,,,
9nbARhUVFE8,,„Solo: A Star Wars Story“ – Interview mit Chewbacca,rollingstoneonline,,2018-05-09T09:42:16Z,,,,,,,,,,Im Gespräch mit ROLLING STONE erzählt Chewbacca von den Dreharbeiten zu „Solo: A Star Wars Story“. Außerdem: Wer in „Krieg der Sterne“ zuerst schoss: ...
kTlv5_Bs8aw,,BTS (방탄소년단) &#39;MIC Drop (Steve Aoki Remix)&#39; Official MV,ibighit,,2017-11-24T09:00:02Z,,,,,,,,,,"BTS (방탄소년단) 'MIC Drop (Steve Aoki Remix)' Official MV Credits: Music Video by GDW, Directed by Woogie Kim Producer: Cathy Kim Production Supervisor: ..."
p8npDG2ulKQ,,BTS (방탄소년단) LOVE YOURSELF 轉 Tear &#39;Singularity&#39; Comeback Trailer,ibighit,,2018-05-06T15:00:02Z,,,,,,,,,,"BTS (방탄소년단) LOVE YOURSELF 轉 Tear 'Singularity' Comeback Trailer Credits: Director : YongSeok Choi (Lumpens) Assistant Director : Wonju Lee, MinJe ..."
OK3GJ0WIQ8s,,j-hope &#39;Daydream (백일몽)&#39; MV,ibighit,,2018-03-01T15:00:02Z,,,,,,,,,,"j-hope 'Daydream (백일몽)' j-hope's 'Daydream (백일몽)', the first mixtape album is out now. Get 'Daydream (백일몽)' on: Google: https://bit.ly/2ovoi8m ..."
8O_MwlZ2dEg,,j-hope &#39;Airplane&#39; MV,ibighit,,2018-03-06T15:00:10Z,,,,,,,,,,j-hope 'Airplane' MV j-hope - 'Hope World' Full Mixtape Download Google: https://bit.ly/2ovoi8m MediaFire: https://bit.ly/2owaKcq Dropbox: ...
7C2z4GqqS5E,,BTS (방탄소년단) &#39;FAKE LOVE&#39; Official MV,ibighit,,2018-05-18T09:00:02Z,,,,,,,,,,"BTS (방탄소년단) 'FAKE LOVE' Official MV Director : YongSeok Choi (Lumpens) Assistant Director : WonJu Lee, Guzza, HyeJeong Park, MinJe Jeong ..."
D_6QmL6rExk,,BTS (방탄소년단) &#39;FAKE LOVE&#39; Official MV (Extended ver.),ibighit,,2018-06-01T15:00:01Z,,,,,,,,,,"BTS (방탄소년단) 'FAKE LOVE' Official MV (Extended ver.) Director : YongSeok Choi (Lumpens) Assistant Director : WonJu Lee, Guzza, HyeJeong Park, MinJe ..."
BP71K87Hp5Y,,BTS (방탄소년단) &#39;FAKE LOVE&#39; Official Teaser 1,ibighit,,2018-05-14T17:01:31Z,,,,,,,,,,"BTS (방탄소년단) 'FAKE LOVE' Official Teaser 1 'FAKE LOVE' MV will be released on May 18, 2018. This video contains Chopin - Valse Op. 69, No. 1 in A flat ..."
kX0vO4vlJuU,,BTS (방탄소년단) &#39;Euphoria : Theme of LOVE YOURSELF 起 Wonder&#39;,ibighit,,2018-04-05T15:00:05Z,,,,,,,,,,BTS (방탄소년단) 'Euphoria : Theme of LOVE YOURSELF 起 Wonder' credits: Director : YongSeok Choi (Lumpens) Assistant Director : WonJu Lee (Lumpens) ...
2Ioa5dOIN3Y,,[EPISODE] Lee Hyun &#39;다음이 있을까&#39; comeback surprise party,ibighit,,2018-03-17T05:00:04Z,,,,,,,,,,
5Lm3KTEtlBM,,LeeHyun (이현) &#39;다음이 있을까 (이런 꽃같은 엔딩 中 - 웅채커플)&#39; MV,ibighit,,2018-02-26T11:01:38Z,,,,,,,,,,LeeHyun (이현) '다음이 있을까 (이런 꽃같은 엔딩 中 - 웅채커플)' MV.
fRsQ7t5FIzA,,NICKELODEON EYESHADOW PALETTE… Is It Jeffree Star Approved???,jeffreestar,,2018-01-31T19:10:24Z,,,,,,,,,,HEY EVERYONE... Where are all my makeup lovers at who grew up in the 90's??? This is such a nostalgic cool idea that I never imagined would happen!
K6TGRxSHm3c,,GET READY WITH ME feat. TANA MONGEAU,jeffreestar,,2018-04-15T18:00:20Z,,,,,,,,,,HEY EVERYONE... The day has finally come where Tana Mongeau and I met for the first time... and we filmed it!!! I thought what better way to get to know each ...
XcJusWTUDJI,,I TRIED FOLLOWING A TANA MONGEAU MAKEUP TUTORIAL… OMG,jeffreestar,,2018-02-14T18:32:37Z,,,,,,,,,,HEY EVERYONE! Today we are diving off the deep end and trying something that isn't been done on this channel before... A new concept has been made ...
q6QKHLVBKsA,,FROM MUG SHOT TO SUPERMODEL MAKEUP TUTORIAL | Blood Sugar Palette,jeffreestar,,2018-02-06T19:55:15Z,,,,,,,,,,"YOU. BETTER. BLEND. Today I brought back my makeup soulmate, Lipstick Nick to recreate another Blood Sugar palette campaign look that she did for this ..."
9kIb4yZHWfg,,THE TRUTH… $360 KYLIE COSMETICS BRUSH SET REVIEW,jeffreestar,,2017-12-14T03:01:13Z,,,,,,,,,,TIME TO SPILL THE TEA... and find out the TRUTH about the new Kylie Cosmetics $360 makeup brush set! Are they worth it and do they actually work??? I have ...
E5RVbs_wScQ,,THE TRUTH… KKW BEAUTY x MARIO COLLECTION REVIEW,jeffreestar,,2018-04-03T17:20:11Z,,,,,,,,,,HEY EVERYONE! Today I'm doing a first impressions and makeup tutorial using the new KKW Beauty x Makeup by Mario collaboration! This collab includes an ...
h5LZ14RgSY8,,BOX OF CRAYONS EYESHADOW PALETTE... Is It Jeffree Star Approved??,jeffreestar,,2018-02-09T18:24:39Z,,,,,,,,,,HEY EVERYONE! Today I'm testing out the viral BOX OF CRAYONS eyeshadow palette from the brand The Crayon Case! This has been tweeted to me and ...
TW7BuUue2QA,,TESTING CRAZY WEIRD AF FACE MASKS w. MY BOYFRIEND: PART 2,jeffreestar,,2018-04-13T17:25:17Z,,,,,,,,,,HEEEEEEY EVERYONE! Nathan and I are BACK at it again trying more crazy weird face masks! Today we test out and do a first impressions on the new viral ...
JyUKqUTp9rc,,WET N WILD &#39;GOTH-O-GRAPHIC&#39; COLLECTION | HIT OR MISS?!,jeffreestar,,2018-02-21T19:09:41Z,,,,,,,,,,"HEY EVERYONE! Today I'm testing out the brand new collection from WET N WILD called ""Gothi-O-Graphic"" and it has ALOT of new products!! You guys know ..."
0u389bHg5nE,,THE JEFFREE STAR TATTOO DIARIES: PART 2,jeffreestar,,2018-03-09T19:02:27Z,,,,,,,,,,"HEY EVERYONE! The second part of my Tattoo Diaries series is finally here! Today we are going to talk about my entire right arm, and share some stories I've ..."
Jh0BnGg22Tg,,Kip Moore - Last Shot (Official Lyric Video),KipMooreVEVO,,2018-01-08T05:00:01Z,,,,,,,,,,"Music video by Kip Moore performing Last Shot. (C) 2017 UMG Recordings, Inc. http://vevo.ly/0bHtRv."
vCWrArYJntc,,Kip Moore - Last Shot (Official Music Video),KipMooreVEVO,,2018-01-23T04:59:01Z,,,,,,,,,,"Music video by Kip Moore performing Last Shot. (C) 2017 UMG Recordings, Inc. http://vevo.ly/o7NKtc."
0juCMuYGJS8,,Kip Moore - Last Shot (Performance Version),KipMooreVEVO,,2018-02-12T05:00:00Z,,,,,,,,,,"Music video by Kip Moore performing Last Shot. (C) 2018 UMG Recordings, Inc. http://vevo.ly/1ksfkW."
8blNPVoh-to,,Kip Moore - The Journey To Slowheart,KipMooreVEVO,,2017-11-20T19:42:28Z,,,,,,,,,,"Music video by Kip Moore performing The Journey To Slowheart. (C) 2017 UMG Recordings, Inc. http://vevo.ly/0h6xxJ."
9Mz84cwVmS0,,Detecting cancer in real-time with machine learning,Google,,2018-04-16T17:00:24Z,,,,,,,,,,"Learn more about our research efforts to create a machine learning and augmented reality-powered microscope for real-time detection of cancer, helping to ..."
vI4LHl4yFuo,,Google — Year in Search 2017,Google,,2017-12-13T07:59:27Z,,,,,,,,,,#YearInSearch Music: Harry Styles - Sign of the Times | https://goo.gl/Kg7cJD Watch past Year In Search videos: http://goo.gl/LXA4nQ C R E D I T S: Border Wall ...
gbRJPa9d-VU,,Making every phone smarter with Federated Learning,Google,,2018-05-07T16:56:03Z,,,,,,,,,,"Federated Learning works through collaborative learning, using de-identified, aggregated information from many devices to improve machine learning models."
Twe0qlqyTfo,,What is Google’s Advanced Protection Program?,Google,,2018-05-31T22:33:30Z,,,,,,,,,,"The Advanced Protection Program is Google's strongest account security, designed to protect anyone who feels vulnerable to highly-targeted attacks. This video ..."
