video_id,trending_date,title,channel_title,category_id,publish_time,tags,views,likes,dislikes,comment_count,thumbnail_link,comments_disabled,ratings_disabled,video_error_or_removed,description 
eACohWVwTOc,,The Chainsmokers - Sick Boy (Official Video),ChainsmokersVEVO,,2018-01-17T15:00:02Z,,,,,,,,,,"""Sick Boy"" Out Now: http://smarturl.it/SickBoy Follow The Chainsmokers: http://www.youtube.com/thechainsmokers http://www.twitter.com/thechainsmokers ..."
DKPCBAlDw2A,,The Chainsmokers - Everybody Hates Me (Official Video),ChainsmokersVEVO,,2018-04-02T14:00:04Z,,,,,,,,,,"The Chainsmokers - Everybody Hates Me ""Everybody Hates Me"" Out Now: http://smarturl.it/EverybodyHatesMe Directed by: Rory Kramer Follow The ..."
tlILlcCE8Sc,,"The Chainsmokers, Drew Love - Somebody (Official Video)",ChainsmokersVEVO,,2018-04-20T14:00:04Z,,,,,,,,,,"The Chainsmokers - Somebody ft. Drew Love ""Somebody"" ft. Drew Love Out Now: http://smarturl.it/TCSsomebody Illustrations by Molly Crabapple Directed by ..."
_hMQe2U4c6w,,The Chainsmokers - You Owe Me (Official Video),ChainsmokersVEVO,,2018-02-16T05:01:00Z,,,,,,,,,,"The Chainsmokers - You Owe Me ""You Owe Me"" Out Now: http://smarturl.it/YouOweMe Directed by Rory Kramer Pre-Production Producer - Matt Komo Follow ..."
12wctGs-4pI,,"The Chainsmokers, Drew Love - Somebody (Ruhde Remix - Audio)",ChainsmokersVEVO,,2018-05-25T04:01:00Z,,,,,,,,,,"The Chainsmokers – Somebody ft. Drew Love Ruhde Remix “Somebody” ft. Drew Love Remixes Out Now: http://smarturl.it/SomebodyRmxs ""Somebody"" ft."
mu9qExCV_fM,,The Chainsmokers - You Owe Me - Behind the Scenes,ChainsmokersVEVO,,2018-03-06T15:00:03Z,,,,,,,,,,"The Chainsmokers - You Owe Me ""You Owe Me"" Out Now: http://smarturl.it/YouOweMe Directed by Rory Kramer Pre-Production Producer - Matt Komo Follow ..."
sQEJ1fZhgUc,,The Chainsmokers - Sick Boy - Behind the Scenes,ChainsmokersVEVO,,2018-02-05T15:00:11Z,,,,,,,,,,Directed by Brewer Follow The Chainsmokers: http://www.youtube.com/thechainsmokers http://www.twitter.com/thechainsmokers ...
E_WEMsETnlY,,The Chainsmokers - Everybody Hates Me - Behind the Scenes,ChainsmokersVEVO,,2018-04-18T14:00:01Z,,,,,,,,,,Music video by The Chainsmokers performing Everybody Hates Me - Behind the Scenes. (C) 2018 Disruptor Records/Columbia Records http://vevo.ly/PAq8Te.
7LX83PfpD7Q,,The Chainsmokers - Sick Boy (Trobi Remix - Audio),ChainsmokersVEVO,,2018-02-09T05:01:00Z,,,,,,,,,,"""Sick Boy"" Out Now: http://smarturl.it/SickBoy Get the remixes: http://smarturl.it/SickBoyRemixes Follow The Chainsmokers: ..."
KfGCOGoYj0g,,The Chainsmokers - Young (KO:YU Remix - Audio),ChainsmokersVEVO,,2017-12-15T05:01:00Z,,,,,,,,,,"Get The Chainsmokers ""Young"" Remix bundle here: http://smarturl.it/YoungRmx The Chainsmokers debut album 'Memories... Do Not Open' is out now!"
5qS4B18G1k0,,golden slumbers - cover,doddlevloggle,,2018-01-02T02:59:11Z,,,,,,,,,,thank u for 2017 pals x love u.
YuAA5DEXbG4,,it me ur valentine,doddlevloggle,,2018-02-14T19:07:15Z,,,,,,,,,,it's the day of love and I guess I'm your date you partook in a youtube game But we can call it fate cause if this wasn't manufactured If it weren't pretend Here's a ...
YV7GMZ3DcGk,,white winter hymnal with my twin,doddlevloggle,,2017-12-07T23:29:32Z,,,,,,,,,,listen to my EP! it's called Intertwined and it's on Spotify and iTunes :D BUSINESS EMAIL: info@dodieclark.com.
H44DgkJXefA,,i am the dancing queen (belfast come to my show tonight pls),doddlevloggle,,2018-03-20T13:59:13Z,,,,,,,,,,this was a bit of a rush of a video so it's like a 6/10 of how I'd have liked to play it but eh it was fun so will! https://twitter.com/willharvey1 ...
1-A1aS8x4lo,,sweet caroline - cover,doddlevloggle,,2018-01-11T03:57:30Z,,,,,,,,,,snapchat and instagram username is doddleoddle my boooook: https://www.amazon.co.uk/Secrets-Mad-Obsessions-Confessions-Lessons/dp/1785036807 ...
tj_IgFmetXM,,my singing voice,doddlevloggle,,2018-04-23T21:27:32Z,,,,,,,,,,"my music is on all platforms like Spotify and iTunes! Just type in ""dodie"". I wrote a book about mental health and the lessons I've learned on how to deal with it."
9MoTBIS18QQ,,everybody gets a kitten - jeremy messersmith cover,doddlevloggle,,2018-04-26T18:10:26Z,,,,,,,,,,"my music is on all platforms like Spotify and iTunes! Just type in ""dodie"" I wrote a book about mental health and the lessons I've learned on how to deal with it."
igna7SL6Z20,,erryday makeup,doddlevloggle,,2018-05-27T17:41:29Z,,,,,,,,,,tbh i've made basically this exact video like 10 times lol but enjoy! they're always fun to make main music channel: http://youtube.com/doddleoddle vevo: ...
YfOHh5mt9SM,,My condition that makes me feel like i&#39;m dreaming all the time | derealisation/depersonalisation,doddlevloggle,,2017-12-14T00:27:19Z,,,,,,,,,,my EPs are called Intertwined and You - on Spotify and iTunes :) BUSINESS EMAIL: info@dodieclark.com MORE TIPS okay spaced out pals. here's the thing.
UwdDMSkBVY4,,she back,doddlevloggle,,2018-04-21T18:49:43Z,,,,,,,,,,"my music is on all platforms like Spotify and iTunes! Just type in ""dodie"". I wrote a book about mental health and the lessons I've learned on how to deal with it."
-r3dzoZx_8g,,Pipsqueak Killed Pipsqueak.,stacyvlogs,,2018-04-15T23:20:37Z,,,,,,,,,,Oh no. Oh no. Oh no. Merch store: http://www.shopstacyplays.com Twitter: twitter.com/stacysays Instagram: instagram.com/stacygrams Facebook: ...
fvKSv9d1kT8,,Introducing My Cat To A Kitten (Milquetoast Meets Pipsqueak),stacyvlogs,,2018-02-14T17:22:28Z,,,,,,,,,,Twitter: twitter.com/stacysays Instagram: instagram.com/stacygrams Facebook: facebook.com/stacyhinojosa Gaming Channel: youtube.com/stacyplays Page ...
VbunGI4fryc,,Rescuing An Emaciated Kitten,stacyvlogs,,2018-02-05T18:28:07Z,,,,,,,,,,Twitter: twitter.com/stacysays Instagram: instagram.com/stacygrams Facebook: facebook.com/stacyhinojosa Gaming Channel: youtube.com/stacyplays Page ...
a50Vm-5w0Es,,I Bought Weird Cat Toys From Amazon,stacyvlogs,,2018-04-11T20:57:16Z,,,,,,,,,,"Note: This video was NOT sponsored, but the above links are ""affiliate"" links. Twitter: twitter.com/stacysays Instagram: instagram.com/stacygrams Facebook: ..."
s-LkRVMg_gQ,,Pip&#39;s Not Sick! | Reintroducing the Cats,stacyvlogs,,2018-05-07T01:54:05Z,,,,,,,,,,Thank you everyone for helping me through these last couple months. Your #PrayersForPip meant the world to me and I cannot belive this is the outcome we ...
uY_3s3FxAs0,,Making A Play Room for My Terminally-Ill Kitten,stacyvlogs,,2018-02-28T22:49:38Z,,,,,,,,,,Twitter: twitter.com/stacysays Instagram: instagram.com/stacygrams Facebook: facebook.com/stacyhinojosa Gaming Channel: youtube.com/stacyplays Page ...
239L5zUOYpQ,,Pip Was Diagnosed With A Fatal Disease (Feline Infectious Peritonitis),stacyvlogs,,2018-02-25T21:12:15Z,,,,,,,,,,"I'm so sorry everyone. Pip took a sudden turn for the worse. The vet diagnosed him with FIP (Feline Infectious Peritonitis), but there's no 100% diagnosis ..."
4gtrHP-D2x4,,Pip&#39;s Shocking Blood Test Results,stacyvlogs,,2018-03-02T23:58:21Z,,,,,,,,,,Twitter: twitter.com/stacysays Instagram: instagram.com/stacygrams Facebook: facebook.com/stacyhinojosa Gaming Channel: youtube.com/stacyplays Page ...
fW-6ahS3UsU,,Back At The Vet - Pipsqueak Kitten Vlog,stacyvlogs,,2018-04-23T01:03:49Z,,,,,,,,,,"Pipdate number... I can't remember. Hoping for some good news soon. Also, my hair is not grey in the beginning... I used a dry shampoo that morning. Twitter: ..."
RvP7fO1XvQQ,,I Rushed Milquetoast To The Vet,stacyvlogs,,2018-02-28T01:27:59Z,,,,,,,,,,"Thank you for all the continued support. I feel strange putting this online for everyone, but I know that my loyal viewers who love these animals as their own will ..."
Br-jo_3PPD8,,Silvia&#39;s Legacy,StoryCorps,,2018-02-22T13:52:35Z,,,,,,,,,,Ellaraino experienced a common teenage reaction when she learned she'd have to leave Los Angeles to spend the summer in Louisiana with her ...
QNeFhMnP7dA,,The Temple of Knowledge,StoryCorps,,2018-02-08T13:59:11Z,,,,,,,,,,"Ronald Clark's father was custodian of a branch of the New York Public Library at a time when caretakers, along with their families, lived in the buildings."
8DiYQwDrxxA,,A Christmas memory about a stolen bike and an unexpected lesson about generosity | StoryCorps,StoryCorps,,2017-12-19T22:44:07Z,,,,,,,,,,"Dr. William Lynn Weaver grew up during the 1950s and 1960s in Mechanicsville, a black working-class neighborhood in Knoxville, Tennessee. In 1964, he was ..."
VWFoCcbXqAw,,Greg talks with  the school shooter who killed his son 25 years ago | StoryCorps,StoryCorps,,2017-12-12T19:00:02Z,,,,,,,,,,"This StoryCorps conversation was one that was difficult to have, and for some, will be hard to hear. It happened at a prison, where a father sat down to talk with ..."
ySx3xNdmg0A,,Dion Diamond remembers the risks he took as a young civil rights activist | StoryCorps,StoryCorps,,2018-01-16T22:15:23Z,,,,,,,,,,"This man is a civil rights activist you probably haven't heard of. His name is Dion Diamond. Growing up in the 1950s and 1960s, Dion was a bit of a prankster, ..."
76yHFpWzuIw,,Lessons Learned,StoryCorps,,2018-05-03T12:09:53Z,,,,,,,,,,"No one succeeds alone. After the difficult experience of helping integrate a Tennessee high school in 1964, Dr. William Lynn Weaver succeeded in spite of some ..."
yrP5He0QQFI,,"Rickey went to prison for a murder he didn&#39;t commit, then met the man who testified | StoryCorps",StoryCorps,,2018-01-09T22:40:11Z,,,,,,,,,,"On May 19, 1975, a shopkeeper named Harold Franks was murdered during a robbery at a small grocery store in Cleveland. That's when the lives of Rickey ..."
F19qAwW2O00,,Juan Romero remembers the night Senator Robert F. Kennedy was assassinated | StoryCorps,StoryCorps,,2018-06-05T18:21:10Z,,,,,,,,,,"On June 5, 1968, Senator Robert F. Kennedy won California's Democratic primary in his bid to become President of the United States. That night, after his victory ..."
lt6luTPe6uo,,Lan recalls some of the fiercest fighting of the Vietnam War before starting life over | StoryCorps,StoryCorps,,2018-02-06T21:06:12Z,,,,,,,,,,"On January 31, 1968, Lan Cao's family was living just outside of Saigon, getting ready to celebrate the Lunar New Year of Tet. Instead, her father — a military ..."
7XKG5ggsoNc,,"Remembering Avielle, one of the 20 children who were murdered at Sandy Hook Elementary | StoryCorps",StoryCorps,,2017-12-14T19:54:26Z,,,,,,,,,,"Every morning, Jennifer Hensel and Jeremy Richman light a candle in honor of their daughter, Avielle. On December 14, 2012, a shooter opened fire at Sandy ..."
FfjsmKvMDJk,,"뮤직뱅크 Music Bank in chile 가시나 - Twice(나연, 모모, 미나, 채영)  20180411",KBSKpop,,2018-04-12T04:31:05Z,,,,,,,,,,"뮤직뱅크 Music Bank in chile 가시나 - Twice(나연, 모모, 미나, 채영) 20180411."
w8nYjwKs_DM,,유희열의 스케치북 Yu Huiyeol&#39;s Sketchbook - KHAN - Despacito (원곡 Luis Fonsi). 20180526,KBSKpop,,2018-05-26T16:49:55Z,,,,,,,,,,KHAN - Despacito (원곡 Luis Fonsi)
lJq7U0Gs0wA,,불후의명곡 Immortal Songs 2 - 세븐틴 - 단발머리.20180505,KBSKpop,,2018-05-05T12:37:52Z,,,,,,,,,,불후의명곡 Immortal Songs 2 - 세븐틴 - 단발머리.20180505.
LJaPaDaT-Uc,,더 유닛 The Unit -  유닛 파랑의 포스 넘치는 ‘미쳐‘20171125,KBSKpop,,2017-11-25T15:21:25Z,,,,,,,,,,유닛 파랑의 포스 넘치는 '미쳐'
8xJn9xvigCY,,불후의 명곡 Immortal Songs2 - 데이식스 - 이젠.20180127,KBSKpop,,2018-01-29T08:43:42Z,,,,,,,,,,데이식스 - 이젠. KBS2 TV 불후의 명곡 Immortal Songs2｜매주 토요일 오후 6시 5분에 방송됩니다.
te_L9ofhUt8,,불후의명곡 Immortal Songs 2 - 소향 - You Raise Me Up .20180512,KBSKpop,,2018-05-12T12:08:43Z,,,,,,,,,,불후의명곡 Immortal Songs 2 - 소향 - You Raise Me Up .20180512.
ug3U76M1ZPA,,뮤직뱅크 Music Bank in chile Despacito - 태민(Taemin) 20180411,KBSKpop,,2018-04-12T04:31:04Z,,,,,,,,,,뮤직뱅크 Music Bank in chile Despacito - 태민(Taemin) 20180411.
Yd1coJw6V2g,,[뮤직뱅크] 6월 2주 1위 ‘방탄소년단 - FAKE LOVE’ 세리머니 Cut[뮤직뱅크] 6월 2주 1위 ‘방탄소년단 - FAKE LOVE’ 세리머니 Cut,KBSKpop,,2018-06-11T07:35:23Z,,,,,,,,,,[뮤직뱅크] 6월 2주 1위 '방탄소년단 - FAKE LOVE' 세리머니 Cut[뮤직뱅크] 6월 2주 1위 '방탄소년단 - FAKE LOVE' 세리머니 Cut.
qNno_pznPWo,,유희열의 스케치북 Yu Huiyeol&#39;s Sketchbook - 나윤권 - 나였으면. 20180526,KBSKpop,,2018-05-26T16:48:59Z,,,,,,,,,,나윤권 - 나였으면.
aKDbh5WO5qE,,유희열의 스케치북 Yu Huiyeol&#39;s Sketchbook - Dear Moon - 아이유.20180602,KBSKpop,,2018-06-02T16:53:05Z,,,,,,,,,,Dear Moon - 아이유.
-B_ZZjD2ZeU,,Why Do Some Animals Get Gigantic?,MinuteEarth,,2017-11-24T18:56:12Z,,,,,,,,,,"Occasionally, internal or external factors change, allowing certain animals to become giant versions of themselves. Thanks also to our supporters on ..."
EQ748TZcuqs,,When Trees Go Nuts,MinuteEarth,,2018-05-10T13:09:30Z,,,,,,,,,,"Every once in a while, all the oaks or spruces or other plants in a region suddenly produce a tremendous bounty of seeds – up to 100 times more than usual."
Ch4d9qEKmHE,,A Disease&#39;s Guide to World Domination,MinuteEarth,,2018-01-09T14:44:57Z,,,,,,,,,,There's something surprising that helps determine how damaging a disease is: distance. Thanks also to our Patreon patrons ...
gxLSTOE5TaM,,How Long Can We Live?,MinuteEarth,,2018-05-29T11:52:19Z,,,,,,,,,,"The human lifespan might be limited, in part, because natural selection just stops working late in life. Thanks to our Patreon patrons ..."
DjjBg8hTaPo,,How Much Food Is There On Earth?,MinuteEarth,,2018-03-22T16:06:12Z,,,,,,,,,,"To learn more, start your googling with these keywords: Food stock: the total amount of any particular food existing at any point in time Strategic reserve: food ..."
_z1sWpfrKEE,,Why Do Birds Migrate Like This?,MinuteEarth,,2017-12-20T15:49:51Z,,,,,,,,,,"Copyright 2016 by James Cheshire and Oliver Uberti. First American Edition published by W. W. Norton & Company, Inc. in 2017. First published in Great Britain ..."
S9Dj-xf3iVo,,Why Pets Have Surprisingly Small Brains,MinuteEarth,,2017-12-06T17:09:45Z,,,,,,,,,,"When we domesticate an animal species, their brains shrink and they freak out less. Thanks also to our supporters on https://www.patreon.com/MinuteEarth And ..."
UakCvl0-tu0,,Why Our Favorite Crops Live Fast and Die Young,MinuteEarth,,2018-01-24T14:26:03Z,,,,,,,,,,"To learn more, start your googling with these keywords: Annual: a plant that typically lives for a year or less Biennial: a plant that typically lives for two years ..."
0qgPnXBq7Q8,,Are Plastics Too Strong?,MinuteEarth,,2018-04-06T16:05:32Z,,,,,,,,,,"The same chemistry that makes plastic tough, light and flexible also makes it nearly impossible to get rid of, because it's hard to break those resilient chemical ..."
S0OICOBR19Q,,Why You Shouldn&#39;t Give Ginger To Monkeys (and other animal sayings),MinuteEarth,,2018-04-25T12:27:28Z,,,,,,,,,,"To learn more, start your googling with these keywords: Sunshower: A meteorological phenomenon in which the sunshines while rain is falling. Idiom: A group of ..."
10QoUi2PmNs,,Warren Buffett: Buying And Holding Index Funds Has Worked | CNBC,CNBC,,2018-05-07T14:30:58Z,,,,,,,,,,"About CNBC: From 'Wall Street' to 'Main Street' to award winning original documentaries and Reality TV series, CNBC has you covered. Experience special ..."
RAvYvyj37UU,,Chamath Palihapitiya: I Am A Buffett &#39;Disciple&#39; But He&#39;s Wrong About Bitcoin | CNBC,CNBC,,2018-05-09T13:49:55Z,,,,,,,,,,"About CNBC: From 'Wall Street' to 'Main Street' to award winning original documentaries and Reality TV series, CNBC has you covered. Experience special ..."
T7qf7VTubbI,,How Funk Band Vulfpeck Took On Spotify | CNBC,CNBC,,2018-04-03T14:19:53Z,,,,,,,,,,"About CNBC: From 'Wall Street' to 'Main Street' to award winning original documentaries and Reality TV series, CNBC has you covered. Experience special ..."
h8FtstMvYH4,,Want To Be A CIA Agent? Here’s How To Become A Spy | CNBC,CNBC,,2018-04-06T17:24:28Z,,,,,,,,,,"About CNBC: From 'Wall Street' to 'Main Street' to award winning original documentaries and Reality TV series, CNBC has you covered. Experience special ..."
lg9jPLoeWJc,,Warren Buffett: Some People Should Not Own Stocks | CNBC,CNBC,,2018-02-26T15:22:44Z,,,,,,,,,,"About CNBC: From 'Wall Street' to 'Main Street' to award winning original documentaries and Reality TV series, CNBC has you covered. Experience special ..."
wZ8H2iRXRSY,,Chamath Palihapitiya: Apple Is &#39;No Different Than Louis Vuitton Or Any Other Luxury Good&#39; | CNBC,CNBC,,2017-12-12T17:26:33Z,,,,,,,,,,"About CNBC: From 'Wall Street' to 'Main Street' to award winning original documentaries and Reality TV series, CNBC has you covered. Experience special ..."
FeSCEalMOL8,,"Drone Delivery Start-Up Zipline Beats Amazon, UPS And FedEx To The Punch | CNBC",CNBC,,2018-04-03T14:27:04Z,,,,,,,,,,"About CNBC: From 'Wall Street' to 'Main Street' to award winning original documentaries and Reality TV series, CNBC has you covered. Experience special ..."
aXuM-LpVD50,,"Tyler &#39;Ninja&#39; Blevins Talks Fortnite, Making Money On Twitch And More",CNBC,,2018-03-19T16:47:51Z,,,,,,,,,,"About CNBC: From 'Wall Street' to 'Main Street' to award winning original documentaries and Reality TV series, CNBC has you covered. Experience special ..."
SqLGrrpFrmo,,Airline Seats Really Are Shrinking | CNBC,CNBC,,2018-05-17T18:20:31Z,,,,,,,,,,"About CNBC: From 'Wall Street' to 'Main Street' to award winning original documentaries and Reality TV series, CNBC has you covered. Experience special ..."
7iMN7M5YLyI,,Here’s Why Companies Are Scrambling For Cobalt | CNBC,CNBC,,2018-02-23T22:27:36Z,,,,,,,,,,"About CNBC: From 'Wall Street' to 'Main Street' to award winning original documentaries and Reality TV series, CNBC has you covered. Experience special ..."
-l6wrTvMcbY,,Azealia Banks - Anna Wintour (Lyric Video),AzealiaBanksVEVO,,2018-04-06T13:00:37Z,,,,,,,,,,Music video by Azealia Banks performing Anna Wintour (Lyric Video). 2018 Entertainment One Music http://vevo.ly/GDolvG #AzealiaBanks #AnnaWintour #Vevo ...
au8QGTiPhEw,,Azealia Banks - Anna Wintour,AzealiaBanksVEVO,,2018-05-24T15:59:22Z,,,,,,,,,,Director- Matt Sukkar Cinematographer: Justin Hamilton Steadicam Operator: Yousheng Tang Editor: Mengfan Wu Producer: Jayne Roberts & Brittany Reeber ...
SGnEiAqFIU4,,Kimbra - Version of Me (Official Music Video),kimbramusic,,2018-02-23T16:51:16Z,,,,,,,,,,Official Lyrics: next time I'll be kinder with you there's just this habit that I have I throw my words around like fire they catch on your good heart and your peace of ...
P7R-gn-b-8Y,,Kimbra - Like They Do On The TV (Official Music Video),kimbramusic,,2018-03-30T15:53:23Z,,,,,,,,,,Camera Assistant - Philipp Jahn Additional Music - Lars Horntveth Producers - Michael Corman and Nicola Fegg Connect with Kimbra: http://KimbraMusic.com ...
vad3Iqbp5s0,,Kimbra - Version of Me (Official Live Tour Video),kimbramusic,,2018-03-16T21:12:31Z,,,,,,,,,,Official Lyrics: next time I'll be kinder with you there's just this habit that I have I throw my words around like fire they catch on your good heart and your peace of ...
3qavbROiXls,,Kimbra - Top of the World (Official Behind The Scenes),kimbramusic,,2017-12-02T01:48:24Z,,,,,,,,,,"The new single Top of the World is available now on Apple Music, Spotify, Google Play, and more. Get the single here - https://kmbra.me/topoftheworld The new ..."
QZRwD-KqGaw,,Kimbra - Primal Heart (Official Tour Trailer),kimbramusic,,2018-02-12T17:58:24Z,,,,,,,,,,Connect with Kimbra: http://KimbraMusic.com http://facebook.com/KimbraMusic http://twitter.com/KimbraMusic.
U98rZw78-iA,,Kimbra - Human (Official Music Video),kimbramusic,,2018-01-19T04:48:07Z,,,,,,,,,,Special thanks to NZ On Air! Video Credits: Director Gregor Nicholas EP James Moore Production Co Fish&Clips Producer Lissandra Leite DP John Toon Editor ...
5WWPakahmHo,,Kimbra - Version of Me (Official Behind The Scenes),kimbramusic,,2018-03-11T16:33:45Z,,,,,,,,,,Official Lyrics: next time I'll be kinder with you there's just this habit that I have I throw my words around like fire they catch on your good heart and your peace of ...
up0i0_mIWW4,,Kimbra - Primal Heart Interactive Site Demo,kimbramusic,,2017-12-13T16:44:26Z,,,,,,,,,,Visit Primal Heart Interactive Site: http://KimbraMusic.com Connect with Kimbra: http://KimbraMusic.com http://facebook.com/KimbraMusic ...
JbWauFAMtzg,,Exposing Our Instagram Explore Pages!,AmazingPhil,,2018-03-07T21:56:46Z,,,,,,,,,,Music: kevin macleod: incompetech.com.
o8lSb-UOA3M,,Dan and Phil Video Bloopers 2017!,AmazingPhil,,2018-01-10T19:30:44Z,,,,,,,,,,Music: kevin macleod: incompetech.com.
6tVdiKBcQWY,,Easter Baking - BUNNY BISCUITS!,AmazingPhil,,2018-03-31T20:34:28Z,,,,,,,,,,Music - Kevin Macleod Incompetech.com.
gwrfwx1QcDQ,,Phil is not on fire 9,AmazingPhil,,2017-11-24T21:06:50Z,,,,,,,,,,"The whiskers are back and we're feeling fine, let's see what happens in Phil is not on fire 9! New merch! 10% off with code BLACKFRIDAY (until Monday night) ..."
MYmQlBpF5e0,,UK vs JAPAN School Lunches! with Dan and Phil,AmazingPhil,,2017-12-11T19:41:44Z,,,,,,,,,,Music: kevin macleod: incompetech.com.
0i-NIcn3oVE,,Reacting to my DELETED VIDEOS!,AmazingPhil,,2018-06-01T22:48:17Z,,,,,,,,,,I trawl through some of my old private videos and look at some questionable choices in both content and hair I have made in my 10 years on YouTube! SEE US ...
4VNVdRLC6sI,,Why I Changed My Emo Hair,AmazingPhil,,2018-05-15T17:47:00Z,,,,,,,,,,Music: Kevin Macleod Incompetech.com.
akNs04ef_Co,,I Read A Letter From My Younger Self,AmazingPhil,,2018-01-25T20:46:40Z,,,,,,,,,,Music: kevin macleod: incompetech.com.
NtmHQC2K8lc,,Drawing My Viewers Challenge!,AmazingPhil,,2018-02-12T22:09:35Z,,,,,,,,,,Music: kevin macleod: incompetech.com.
iQOCFA9HI2g,,A Week in the Life of Dan and Phil!,AmazingPhil,,2018-04-22T20:57:44Z,,,,,,,,,,Music: Kevin Macleod Incompetech.com.
48-pr5-G6Pw,,HAIM - Night So Long (Live At The Greek),HaimVEVO,,2018-01-26T19:30:01Z,,,,,,,,,,"Director: Paul Thomas Anderson Recording Produced, Engineered and Mixed by Ariel Rechtshaid Production Supervisor: Karen Ramirez Editor: Andy ..."
mouW8XZ36L0,,HAIM - Walking Away (Mura Masa Remix),HaimVEVO,,2017-12-08T10:00:05Z,,,,,,,,,,HAIM - Walking Away (Mura Masa Remix) Follow HAIM: http://facebook.com/haimtheband http://twitter.com/haimtheband http://instagram.com/haimtheband ...
E_mU-Z-bKbw,,Evanescence - Missing (Official Audio),EvanescenceVEVO,,2018-05-04T04:00:04Z,,,,,,,,,,"Music video by Evanescence performing Missing. © 2016 The Bicycle Music Company, Inc., Distributed by Concord Music Group, Inc. http://vevo.ly/aVg8yN."
sGXvBJN2LZw,,Evanescence - Breathe No More (Official Audio),EvanescenceVEVO,,2018-05-04T04:00:12Z,,,,,,,,,,"Music video by Evanescence performing Breathe No More. © 2016 The Bicycle Music Company, Inc., Distributed by Concord Music Group, Inc."
5yUNctxBPRo,,Evanescence - The Last Song I&#39;m Wasting On You (Official Audio),EvanescenceVEVO,,2018-05-04T04:00:00Z,,,,,,,,,,"Music video by Evanescence performing The Last Song I'm Wasting On You. © 2016 The Bicycle Music Company, Inc., Distributed by Concord Music Group, Inc."
ife5Zij94_E,,Evanescence - Together Again (Official Audio),EvanescenceVEVO,,2018-05-04T04:00:07Z,,,,,,,,,,"Music video by Evanescence performing Together Again. © 2016 The Bicycle Music Company, Inc., Distributed by Concord Music Group, Inc."
UVTYDrCLD1U,,Evanescence - Disappear (Official Audio),EvanescenceVEVO,,2018-05-04T04:00:02Z,,,,,,,,,,"Music video by Evanescence performing Disappear. © 2016 The Bicycle Music Company, Inc., Distributed by Concord Music Group, Inc. http://vevo.ly/DIkTf5."
es_rHRSHmDU,,Evanescence - A New Way To Bleed (Official Audio),EvanescenceVEVO,,2018-05-04T04:00:02Z,,,,,,,,,,"Music video by Evanescence performing A New Way To Bleed. © 2016 The Bicycle Music Company, Inc., Distributed by Concord Music Group, Inc."
iQOcg_2-nX8,,Evanescence - Farther Away (Official Audio),EvanescenceVEVO,,2018-05-04T04:00:06Z,,,,,,,,,,"Music video by Evanescence performing Farther Away. © 2016 The Bicycle Music Company, Inc., Distributed by Concord Music Group, Inc."
3AZ1sgLPdvA,,Evanescence - Secret Door (Official Audio),EvanescenceVEVO,,2018-05-04T04:00:00Z,,,,,,,,,,"Music video by Evanescence performing Secret Door. © 2016 The Bicycle Music Company, Inc., Distributed by Concord Music Group, Inc. http://vevo.ly/S7ztCt."
76oQMBNGgt0,,Evanescence - Say You Will (Official Audio),EvanescenceVEVO,,2018-05-04T04:00:00Z,,,,,,,,,,"Music video by Evanescence performing Say You Will. © 2016 The Bicycle Music Company, Inc., Distributed by Concord Music Group, Inc."
1vN2xkqrmJc,,Evanescence - If You Don’t Mind (Official Audio),EvanescenceVEVO,,2018-05-04T04:00:00Z,,,,,,,,,,"Music video by Evanescence performing If You Don't Mind. © 2016 The Bicycle Music Company, Inc., Distributed by Concord Music Group, Inc."
GCTyFp0PpHE,,"Marbles, Magnets, and Music (Synchronized)",DoodleChaos,,2018-01-09T17:32:39Z,,,,,,,,,,"I've taken the piece ""Waltz of the Flowers"" by Tchaikovsky, and synchronized it to a chain reaction marble run by hand. After listening to parts of this song ..."
W8oIeL_OPc8,,Line Rider - Fade,DoodleChaos,,2018-02-06T17:33:33Z,,,,,,,,,,"I've synchronized the song ""Fade"" by Alan Walker to the physics of a Line Rider track drawing everything by hand. It only took about 3 months of work!"
jWpl58iJ1oo,,Dude Perfect on a Budget | 2-D Trick Shots,DoodleChaos,,2018-05-20T17:38:28Z,,,,,,,,,,Orange ball launched into a mini basketball hoop using little contraptions. The shot at 1:12 took more time than I'd like to admit. If you would like to support me ...
