video_id,trending_date,title,channel_title,category_id,publish_time,tags,views,likes,dislikes,comment_count,thumbnail_link,comments_disabled,ratings_disabled,video_error_or_removed,description 
jMfmjqMIT3A,,Inside a Poundland 9V alkaline battery.  (Check polarity of cells if re-using!),bigclivedotcom,,2018-03-27T12:07:11Z,,,,,,,,,,If you repurpose the internal cells then check polarity. The shell may be positive and pip negative. Someone recently asked if they could use the internal cells ...
XD7M_tJ-SwM,,A look at three different energy saver plugs.,bigclivedotcom,,2017-12-07T16:04:57Z,,,,,,,,,,I've looked at these quack products before (they don't reduce your power bill). This time I thought I'd buy some from different sources including two with different ...
zAoHnbBmfsI,,Why I never show my power supply.,bigclivedotcom,,2018-02-06T21:40:52Z,,,,,,,,,,"I like this power supply, but it's got a huge design flaw. It has three voltage ranges which can be set independently for voltage and current limits in the range of ..."
UxAARAqAjrk,,Wire stripping machine and questions and answers?,bigclivedotcom,,2018-06-07T12:57:45Z,,,,,,,,,,A very handy tool that I bought a long time ago at the peak of my manufacturing of fairground lighting controllers. This saved a lot of wear and tear on my fingers.
ZXMlUqGTIEI,,This video could save your life.  (Aspod keyfob giveaway.),bigclivedotcom,,2018-02-20T07:09:32Z,,,,,,,,,,The competition is now closed and all winners have been informed. I was not paid to make this video. I just think it's a very good idea. So good that I've got six of ...
qBwJC5BtUGY,,Trying out a Canadian MRE (Menu 6).,bigclivedotcom,,2018-03-20T05:18:15Z,,,,,,,,,,"A look at, and taste test of a Canadian MRE military ration pack. This tasted pretty good except for the powdered fruit drink which had a strong chemical smell ..."
mOy7oO2DToc,,Make a trashy hot cookie-pudding in just three minutes.,bigclivedotcom,,2017-11-27T18:19:02Z,,,,,,,,,,A super fast way to make a hot pudding/dessert type thing out of ordinary cookies and milk. The flour in the cookies forms a thick cake-batter like texture with the ...
XC0YPNJo6mA,,Autopsy of faulty LED lamp.  670 volt PSU!  with schematic.,bigclivedotcom,,2018-05-28T20:23:23Z,,,,,,,,,,This rather interesting LED lamp was sent in by Mark. It had lasted about 30 seconds before failing with a dim flicker. The really weird bit is that this lamp has a ...
WE-b2LjRW5E,,How a petroleum-distillate powered pocket heater works.  (naptha),bigclivedotcom,,2018-02-19T18:33:44Z,,,,,,,,,,Note that the recommended fuel for these is standard lighter fuel which is a fairly clean burning(ish) petroleum distillate. Keep in mind these fuels will burn ...
S5uiupJQc9M,,Inside a pleasingly scary Russian 240V gas igniter.,bigclivedotcom,,2018-02-05T15:11:52Z,,,,,,,,,,"This device is probably not terribly compliant in most countries, but is classic Russia/Ukraine technology. Apparently it's not actually rated for 240V but 220 is ..."
ASNA5kkMQ20,,Baking a Mini Unicorn Cake in an EASY BAKE OVEN!! 💖,kawaiisweetworld,,2018-01-30T01:15:07Z,,,,,,,,,,FTC: This video is not sponsored.
g17ah3nWoz8,,How to Make MINI Kawaii Animal Macarons!,kawaiisweetworld,,2017-11-25T23:40:12Z,,,,,,,,,,FTC: This video is not sponsored.
l4Mf_U_Ldm8,,How to Make an Easter Basket Carrot Cake!,kawaiisweetworld,,2018-03-22T22:53:25Z,,,,,,,,,,"If you make this cake, I would LOVE to see it! Be sure to share your recreations by tagging me at @kawaiisweeteats and @CHSugar! ❤ ♥ Website: ..."
n4npAESM_gE,,How to Make Mini No Bake Galaxy Cheesecakes!,kawaiisweetworld,,2018-05-29T20:40:20Z,,,,,,,,,,------------- Helloooo there and welcome back!! Today we are making some Mini No-Bake Galaxy Cheesecakes inspired by Disney's A Wrinkle In Time!
QeAQYhLh4Uw,,How to Make Pusheen Cookie Dough Brownie Filled Chocolates!,kawaiisweetworld,,2018-04-15T20:50:51Z,,,,,,,,,,FTC: This video is not sponsored.
4eyXWEE-P1c,,How to Make Mini Gingerbread Houses (100% Edible)!,kawaiisweetworld,,2017-12-18T19:31:24Z,,,,,,,,,,"Note:C&H® Sugar is sold where I live, but if they don't sell it in your area, look for Domino® Sugar, the sister brand of C&H® Sugar! C&H® Sugar: ..."
O7KFVNsF_60,,How to Make FIVE Kawaii Holiday Slimes! 🎄🎁,kawaiisweetworld,,2017-12-17T00:44:12Z,,,,,,,,,,"Aaaand as for this week's video: you guys have been requesting it, so today we're making it happen with FIVE kawaii holiday-themed slime recipes! Enjoy!"
wF3-yOaOuBE,,Last-Minute DIY Kawaii Edible Holiday Gifts People ACTUALLY Want (Cake Mix Hacks!),kawaiisweetworld,,2017-12-24T00:53:37Z,,,,,,,,,,FTC: This video is not sponsored.
GV5-Xmg0LWQ,,"KAWAII Valentine&#39;s Day DIYs! 💖 (Squishies, Slime, and Pins)!",kawaiisweetworld,,2018-02-11T03:25:16Z,,,,,,,,,,FTC: This video is not sponsored.
kqdfg-RyxcM,,How to Make MINI Kawaii Rainbow Waffles!,kawaiisweetworld,,2018-03-28T01:38:32Z,,,,,,,,,,FTC: This video is not sponsored Music courtesy of Nicolai Heidlas “A Way For Me” and “Morning Sun”
LeWtF5y9-6Q,,Old Movies Used To Just Shoot Real Bullets At People,Cracked,,2017-11-28T17:00:03Z,,,,,,,,,,"The way movie gunfights used to go down proves that sometimes, really, practical effects are not the way to go. CHECK US OUT on AMAZON: ..."
xi8u9DcC0_Q,,If Tampon Ads Were Honest (Also Maxi Pads &amp; Other &quot;Feminine Products&quot;),Cracked,,2017-12-04T17:00:06Z,,,,,,,,,,"Not that we want tampon ads to get all into the graphic details of what their products actually do. But seriously, what's with all the yoga and blue fluids?"
-El8z4uy5Ac,,The Best Movie Hell to End Up In - After Hours,Cracked,,2017-11-20T17:00:00Z,,,,,,,,,,"The gang gets together for a frank discussion of what happens after you die (in movies like Disney's Hercules and Bedazzled), on a quest of spiritual discovery to ..."
hH5jnG-2HFE,,The Weirdest Part Of Westworld Isn’t The Robots (Illogical Conclusion),Cracked,,2017-11-19T16:30:02Z,,,,,,,,,,"Here at Illogical Conclusion, we dive right past plot twists and turns and player piano Radiohead covers, and get right to the heart of what everyone wants to ..."
feMut5cvng0,,4 Movie Side Characters Screwed by the Hero - Obsessive Pop Culture Disorder,Cracked,,2017-11-27T17:00:05Z,,,,,,,,,,"As always, Daniel O'Brien is here to make you stop and think about the characters so many movies have pushed to the side and forced to the background. We're ..."
r5mkSoGZkRI,,How to Fix Godzilla with One Small Change,Cracked,,2017-11-17T17:00:09Z,,,,,,,,,,"Remember the Godzilla movie from 2014? The one with Bryan Cranston? Yeah, we don't really either. But, we have a foolproof formula for fixing that! CHECK ..."
ivpqUnAC4lk,,Terrifying Things Nobody Tells You About Pregnancy - Cracked Responds,Cracked,,2017-11-23T17:00:06Z,,,,,,,,,,"Thanksgiving is a time for family, so we're taking a little time today to let some of the female Cracked staffers in on what, exactly, is involved in starting their own ..."
JR4oPuV3CWg,,4 Life Hacks that Will Ruin Your Life,Cracked,,2017-12-03T17:00:01Z,,,,,,,,,,"Life Hack: Don't pay attention to, like, 80% of life hacks. They're garbage. As are these four pieces of conventional wisdom. CHECK US OUT on AMAZON: ..."
Jh0sxteKLNM,,"President Trump&#39;s Stupid Fake News Awards, Because He Asked  - Some News",Cracked,,2017-12-02T17:00:02Z,,,,,,,,,,"President Donald J. Trump has been obsessed with Fake News since before he took office, and recently put forth a challenge on Twitter to give a Fake News ..."
wppAQ8uZpfQ,,How Millennials Are Killing the Diamond Industry,Cracked,,2017-11-26T17:00:06Z,,,,,,,,,,"You can't click a headline this day without hearing what industry Millennials are killing. But now, the notorious Killer Millennial is confessing: that's right."
GAI-0FyGbjk,,HAPPY 8th BIRTHDAY BROCK!,SHAYTARDS,,2018-06-11T05:41:18Z,,,,,,,,,,I want him to have everything I have and much much more! Happy Birthday son.
irWulJVjfxE,,I Knew You Were Trouble - Taylor Swift (Official Music Cover) SHAYTARDS,SHAYTARDS,,2018-05-06T03:51:06Z,,,,,,,,,,Please click to Subscribe! http://www.youtube.com/SHAYTARDS Colette: http://instagram.com/katiletters http://twitter.com/Katilette Shay: ...
IJOXgUyXTFo,,Riptide - Vance Joy (Cover by SHAYTARDS),SHAYTARDS,,2018-05-12T21:55:00Z,,,,,,,,,,Last song Saturday!I Knew You Were Trouble - Taylor Swift (Official Music Cover) SHAYTARDS https://www.youtube.com/watch?v=irWulJVjfxE.
SHJdT5TwNsg,,Tightrope - The Greatest Showman (Cover by SHAYTARDS),SHAYTARDS,,2018-05-20T02:07:06Z,,,,,,,,,,Last weeks song Saturday! Riptide - Vance Joy (Cover by SHAYTARDS) https://youtu.be/IJOXgUyXTFo I Knew You Were Trouble - Taylor Swift (Official Music ...
AUt9PdafTeE,,WHAT iF WE DiD THiS EVERYDAY?!,SHAYTARDS,,2018-05-01T21:05:36Z,,,,,,,,,,Please click to Subscribe! http://www.youtube.com/SHAYTARDS Colette: http://instagram.com/katiletters http://twitter.com/Katilette Shay: ...
kpOR5p_4AR4,,HER LAST DAY AS A KiD!,SHAYTARDS,,2018-05-04T21:52:20Z,,,,,,,,,,Please click to Subscribe! http://www.youtube.com/SHAYTARDS Colette: http://instagram.com/katiletters http://twitter.com/Katilette Shay: ...
juWI_vJ-_Do,,SHAYTARDS EASTER EGG HUNT!,SHAYTARDS,,2018-04-01T23:20:57Z,,,,,,,,,,Hoppy Easter everyone!
8zJp3U01GOw,,MAGIC IN SUNNY SOUTHERN CALIFORNIA!!!,SHAYTARDS,,2018-06-12T22:40:01Z,,,,,,,,,,Check out the new SHAYLOSS video! https://youtu.be/jxY1kL8N11k Join our Diet Bet team! The pot is now ...
7NG0ajujtvg,,DiD i DO GOOD?,SHAYTARDS,,2018-05-28T19:00:10Z,,,,,,,,,,Trixin Sunglasses! http://www.TRIXIN.com Ear Cleaners- http://www.UtilityTip.com Colette: http://instagram.com/katiletters http://twitter.com/Katilette Shay: ...
6ezfn7kBPN4,,Are you shy to vlog?,SHAYTARDS,,2018-04-02T16:55:36Z,,,,,,,,,,Did you see who found the golden egg? Easter Egg hunt video... https://youtu.be/juWI_vJ-_Do.
QfeMyvCivqE,,1984 TOYOTA COROLLA Ad-2,automotivemaster1972,,2018-04-06T04:19:44Z,,,,,,,,,,昭和59年CM トヨタ カローラ.
4ieEydivpfg,,2003 HONDA CIVIC Ad,automotivemaster1972,,2018-04-06T04:21:05Z,,,,,,,,,,平成15年CM ホンダ シビック EU.
GCi7hPs9GLE,,1984 TOYOTA CAMRY Ad,automotivemaster1972,,2018-04-06T04:19:14Z,,,,,,,,,,昭和59年CM トヨタ カムリ.
T8nTDfoOnk4,,1984 TOYOTA MARK II Ad,automotivemaster1972,,2018-04-06T04:19:58Z,,,,,,,,,,昭和59年CM トヨタ マークII.
rgNhLYD_NWA,,1984 NISSAN SUNNY Ad,automotivemaster1972,,2018-04-06T04:18:35Z,,,,,,,,,,昭和59年CM 日産 サニー.
Asddi75YBVY,,2005 HONDA CIVIC Ad-0,automotivemaster1972,,2018-04-06T04:21:15Z,,,,,,,,,,平成17年CM ホンダ シビック FD1.
nANHHGgITxE,,1984 TOYOTA VISTA Ad,automotivemaster1972,,2018-04-06T04:20:05Z,,,,,,,,,,昭和59年CM トヨタ ビスタ.
wU354vSu25g,,1984 TOYOTA CAMRY Ad-2,automotivemaster1972,,2018-04-06T04:19:24Z,,,,,,,,,,昭和59年CM トヨタ カムリ.
ebvdptyrOuM,,1984 TOYOTA Ad-2,automotivemaster1972,,2018-04-06T04:18:54Z,,,,,,,,,,昭和59年CM トヨタ.
noCsLj0hMhY,,1984 TOYOTA VISTA Ad-2,automotivemaster1972,,2018-04-06T04:20:09Z,,,,,,,,,,昭和59年CM トヨタ ビスタ.
d2TrEsA3nzg,,Tori Kelly - Help Us To Love ft. The HamilTones (Official Audio) ft. The HamilTones,ToriKellyVEVO,,2018-03-30T04:00:02Z,,,,,,,,,,"There's a love so high (That you cannot get over) That same love's so wide (It'll take forever just to get around it) But love died somewhere, behind that cross you ..."
KQRq9FZqNj0,,"John Legend, BloodPop® - A Good Night ft. BloodPop®",johnlegendVEVO,,2018-04-06T14:00:03Z,,,,,,,,,,Director: Mishka Kornai Production Company: Whitelist.tv Executive Producers: Jerad Anderson & Seb Webber Producer: Ryan Huffman Lyrics: But everything's ...
ATQZVOWOCKk,,"John Legend - All of Me (Live from iTunes Festival, London, 2013)",johnlegendVEVO,,2018-06-01T07:00:00Z,,,,,,,,,,"Music video by John Legend performing All of Me (Live from iTunes Festival, London, 2013). (C) 2013 Getting Out Our Dreams and Columbia Records, ..."
y_zftf3bVUM,,"John Legend - Dancing In the Dark (Live from iTunes Festival, London, 2013)",johnlegendVEVO,,2018-05-12T04:02:03Z,,,,,,,,,,"Music video by John Legend performing Dancing In the Dark (Live from iTunes Festival, London, 2013). (C) 2013 Columbia Records, a division of Sony Music ..."
cizze1L1Zh8,,"John Legend - So High (Live from iTunes Festival, London, 2013)",johnlegendVEVO,,2018-05-12T04:20:26Z,,,,,,,,,,"Music video by John Legend performing So High (Live from iTunes Festival, London, 2013). (C) 2013 Columbia Records, a division of Sony Music Entertainment ..."
qujZK4WhTXo,,"John Legend - Ordinary People (Live from iTunes Festival, London, 2013)",johnlegendVEVO,,2018-05-12T04:10:42Z,,,,,,,,,,"Lyrics: Girl, I'm in love with you This ain't the honeymoon Past the infatuation phase Right in the thick of love At times we get sick of love It seems like we argue ..."
gHUSPoRPwm4,,"Love In The Future / The Beginning... (Live from iTunes Festival, London, 2013)",johnlegendVEVO,,2018-06-01T07:00:02Z,,,,,,,,,,"Music video by John Legend performing Love In The Future / The Beginning... (Live from iTunes Festival, London, 2013). (C) 2013 Getting Out Our Dreams and ..."
-C_rvt0SwLE,,Imagine Dragons - Next To Me (Audio),ImagineDragonsVEVO,,2018-02-21T17:00:00Z,,,,,,,,,,Music video by Imagine Dragons performing Next To Me. (C) 2018 KIDinaKORNER/Interscope Records http://vevo.ly/nSyRBQ.
ydPYNo8o-lI,,"Imagine Dragons, Khalid - Thunder / Young Dumb &amp; Broke (Medley/Audio)",ImagineDragonsVEVO,,2017-12-20T05:00:02Z,,,,,,,,,,"Music video by Imagine Dragons, Khalid performing Thunder / Young Dumb & Broke. (C) 2017 KIDinaKORNER/Interscope Records http://vevo.ly/Sw6D9u ..."
WLagbArQsuE,,Imagine Dragons - Thunder (Live On The Ellen DeGeneres Show/2017),ImagineDragonsVEVO,,2017-11-27T19:57:14Z,,,,,,,,,,#ImagineDragons #Thunder #Vevo #Indie #OfficialLive #EllenDeGeneres.
Txlk7PiHaGk,,Imagine Dragons - Next To Me,ImagineDragonsVEVO,,2018-03-13T18:00:05Z,,,,,,,,,,Directed By Mark Pellington Music video by Imagine Dragons performing Next To Me. © 2018 KIDinaKORNER/Interscope Records http://vevo.ly/2nM36L.
KGziD2V8Ppw,,Imagine Dragons - Whatever It Takes (Miss Congeniality Remix/Audio),ImagineDragonsVEVO,,2017-11-17T05:00:01Z,,,,,,,,,,Music video by Imagine Dragons and Miss Congeniality performing Whatever It Takes. (C) 2017 KIDinaKORNER/Interscope Records http://vevo.ly/Q5sT35 ...
wP8V_Jel0k4,,"Steve-O Expresses Concern for Bam Margera, Offers Earnest Advice on Getting Sober | TMZ",TMZ,,2018-01-14T16:33:50Z,,,,,,,,,,"Steve-O's glad his old friend Bam Margera has checked into rehab, but as an expert on the topic ... he knows Bam's got a long way to go in beating his addiction."
vPPIhG0BFXc,,Rapper Tekashi69 and Crew in Massive Brawl at LAX | TMZ,TMZ,,2018-02-21T19:06:02Z,,,,,,,,,,Rapper Tekashi69 and his crew got into a HUGE brawl at LAX that spilled out into the street ... as about 7 or 8 guys threw haymaker after haymaker.
IeA7lvC1ego,,Kanye West&#39;s Rant In TMZ Office (Extended Cut) | TMZ,TMZ,,2018-05-02T18:06:36Z,,,,,,,,,,This is an extended cut of Kanye's Rant on TMZ Live including his heated back-and-forth with Van Lathan. SUBSCRIBE: http://po.st/TMZSubscribe About TMZ: ...
CAbifX1bgkI,,Tekashi69 Says His Crew Did Not Fire a Shot at Chief Keef | TMZ,TMZ,,2018-06-03T15:50:58Z,,,,,,,,,,"Tekashi69 denies his crew took a shot at Chief Keef ... in fact, he says his MO is the opposite of violence. SUBSCRIBE: http://po.st/TMZSubscribe About TMZ: ..."
1qr76JOA8Vo,,Travis Barker Tells Son the Lil Pump Face Tattoos Are Off Limits | TMZ,TMZ,,2018-02-18T22:30:52Z,,,,,,,,,,Travis Barker's pumping the brakes on his 14-year-old son ripping a page outta Lil Pump's playbook ... at least for now. SUBSCRIBE: http://po.st/TMZSubscribe ...
RnePGHyXxQ0,,T.I. and Cop Argue About Reason for His Arrest in Jailhouse Video | TMZ,TMZ,,2018-05-17T02:48:58Z,,,,,,,,,,"T.I. was adamant he didn't deserve to be arrested for an incident with the security guard at his gated community, because he was just trying to ask the guy some ..."
BisCwCGhxwI,,Rapper Tricks Our Camera Guy! | TMZ TV,TMZ,,2018-05-15T17:00:00Z,,,,,,,,,,That's just not right .. LOL! SUBSCRIBE: http://po.st/TMZSubscribe About TMZ: TMZ has consistently been credited for breaking the biggest stories dominating ...
3G7s03xdPQc,,"Nipsey Hussle&#39;s Armored Truck Towed, He Says Cops Have it Out for Him | TMZ",TMZ,,2018-02-17T17:53:22Z,,,,,,,,,,"Nipsey Hussle's armored truck was towed because it was illegally parked in a handicap spot ... this according to law enforcement sources, but the rapper's ..."
9reiHde4-yo,,"Blac Youngsta Crashes McDonald&#39;s Late Night, Gets Manager Fired | TMZ",TMZ,,2017-11-19T17:39:56Z,,,,,,,,,,"Blac Youngsta got a serious case of the late night munchies after a North Carolina gig, hopped a McDonald's drive-thru line and set off a string of hijinks that cost ..."
5gmpv2R356I,,Gene Simmons&#39; Son Nick Defends His Dad After Sexual Assault Lawsuit | TMZ,TMZ,,2017-12-22T16:30:00Z,,,,,,,,,,"Gene Simmons' oldest son is coming to his dad's defense -- sort of -- calling him a cheater, egomaniac and sometimes abrasive ... but saying he's absolutely not ..."
i5fxxMRzi1Q,,JAY-Z - Marcy Me,JayZVEVO,,2017-12-22T05:00:03Z,,,,,,,,,,"Music video by JAY-Z performing Marcy Me. (C) 2017 S. Carter Enterprises, LLC. Marketed by Roc Nation & Distributed by Roc Nation/UMG Recordings, Inc."
VVEK0AWeTWA,,JAY-Z - Blue’s Freestyle,JayZVEVO,,2018-01-12T05:00:01Z,,,,,,,,,,"Music video by JAY-Z performing Blue's Freestyle. (C) 2018 S. Carter Enterprises, LLC. Marketed by Roc Nation & Distributed by Roc Nation/UMG Recordings, ..."
SSumXG5_rs8,,JAY-Z - Smile ft. Gloria Carter,JayZVEVO,,2017-12-22T05:00:00Z,,,,,,,,,,"Music video by JAY-Z performing Smile. (C) 2017 S. Carter Enterprises, LLC. Marketed by Roc Nation & Distributed by Roc Nation/UMG Recordings, Inc."
z2kEKZ6jyQQ,,JAY-Z - Family Feud ft. Beyoncé,JayZVEVO,,2018-01-05T05:00:06Z,,,,,,,,,,"Music video by JAY-Z performing Family Feud. (C) 2018 S. Carter Enterprises, LLC. Marketed by Roc Nation & Distributed by Roc Nation/UMG Recordings, Inc."
dHOTgIEmixc,,JAY-Z - Legacy,JayZVEVO,,2017-12-22T05:00:02Z,,,,,,,,,,"Music video by JAY-Z performing Legacy. (C) 2017 S. Carter Enterprises, LLC. Marketed by Roc Nation & Distributed by Roc Nation/UMG Recordings, Inc."
0-_h-qFt_zs,,Peking Duk - Wasted (Official Video),PekingDukVEVO,,2018-02-01T21:00:00Z,,,,,,,,,,Video by ryansauermedia.com Crew: Director: Ryan Sauer Director Of Photography: Ryan Sauer Assistant Director & Focus Puller: Ed Reiss Lighting: ...
4GboBAg2Syo,,Peking Duk - Reprisal (Official Video),PekingDukVEVO,,2018-05-10T20:00:00Z,,,,,,,,,,Music video by Peking Duk performing Reprisal (Official Video). (C) 2018 Sony Music Entertainment Australia Pty Ltd http://vevo.ly/DTzPvs Peking Duk ...
YbHdBoHMxK4,,Parson James - Only You (Lyric Video),ParsonJamesVEVO,,2017-11-17T08:00:02Z,,,,,,,,,,Only You” by Parson James Available Now! iTunes - http://smarturl.it/PJOnlyYou/itunes?iQid=yt Apple Music - http://smarturl.it/PJOnlyYou/applemusic?iQid=yt ...
2Xyf_PCf7lc,,Parson James - Only You (Official Video),ParsonJamesVEVO,,2018-02-07T14:30:00Z,,,,,,,,,,"""Only You"" by Parson James Available Now! iTunes - http://smarturl.it/PJOnlyYou/itunes?iQid=yt Apple Music - http://smarturl.it/PJOnlyYou/applemusic?iQid=yt ..."
gBYn615qxEQ,,Parson James - Only You (Midnight Kids Remix (Audio)),ParsonJamesVEVO,,2018-02-09T08:00:05Z,,,,,,,,,,"The Midnight Kids and Frank Pole Remixes of ""Only You"" available now! Only You (Midnight Kids Remix) iTunes: http://smarturl.it/PJOYMKR/itunes?iQid=yt ..."
Q0vuY1YJnvM,,Parson James - Only You (Frank Pole Remix (Audio)),ParsonJamesVEVO,,2018-02-09T08:00:03Z,,,,,,,,,,"The Frank Pole and Midnight Kids Remixes of ""Only You"" available now! Only You (Frank Pole Remix) iTunes: http://smarturl.it/PJOYFPR/itunes?iQid=yt Apple ..."
I3lJWcRSlUA,,Aggressively Low Power with the ESP8266,CNLohr,,2018-01-16T14:36:14Z,,,,,,,,,,I wanted to see how low power the ESP8266 could be if it was no longer constrained by the infrastructure of 802.11. The results were shocking. Power savings ...
_LnZrXrdC00,,Cypress FX3 as a Possible Logic Analyzer,CNLohr,,2017-12-31T00:39:40Z,,,,,,,,,,"Or how I leaned what spite coding is!) Update Dec 31 @ 3AM: Now, client-side stuff works in Linux and Windows. Same sweet sweet 200 MB/sec stream."
eSN8ArUFUzc,,Two algorithms: head-to-head (libsurvive april 2018),CNLohr,,2018-04-13T04:49:00Z,,,,,,,,,,LibSurvive is an open source lighthouse tracking system aimed at supporting the HTC Vive. Check out the github here: http://github.com/cnlohr/libsurvive See ...
o7CYATVZTmE,,I got tantalum caps from the wrong source,CNLohr,,2017-12-12T17:31:02Z,,,,,,,,,,First: Anyone have a legit high-speed camera. I'd love to see some of them goin off on a real high speed camera! I am working on a project where I'll need to be ...
edgF01qTudw,,Vive without the tether (or desktop PC!),CNLohr,,2018-04-02T02:47:56Z,,,,,,,,,,Yep. Totally. No wires. Just vive. (And an OrangePi One) :-D Livestream: https://www.youtube.com/watch?v=azyt_Vt96bg Spreadgine: ...
OZ_YPILt_Jo,,Serial terminal into a vive lighthouse.,CNLohr,,2018-01-26T01:28:58Z,,,,,,,,,,"This video was recorded on May 27, 2017. I just didn't get to uploading it until now. Sorry guys. ESP8266 Lighthouse: ..."
CGKOtI00NQ4,,Straightening out Christmas lights with a reflow station,CNLohr,,2017-12-12T17:04:02Z,,,,,,,,,,"I hate squirrel-y Christmas lights. Not on my house. Realistically, this is totally unnecessary. In the long run it only makes them a little straighter. I don't ..."
azyt_Vt96bg,,Wireless Vive with an Orange Pi (libsurvive #13),CNLohr,,2018-04-01T21:56:56Z,,,,,,,,,,"Tune in today, April 1st to see us trying to make a totally wireless Vive setup using an Orange Pi! Spreadgine: https://github.com/cnlohr/spreadgine libsurvive: ..."
16NSQORHRqU,,Making tools to make programming livestreams more fun,CNLohr,,2018-05-09T04:40:20Z,,,,,,,,,,"We're going to be working on my ""cnlohr_social_media_tools"" toolset in this livestream today... Including the legal use of music! Come out to see some live ..."
4QZOskGOzoE,,libsurvive livestream #11 - Let&#39;s get our bearings again!,CNLohr,,2018-03-14T21:35:39Z,,,,,,,,,,"Mark, Dylan and now we're including Abhijeet doing some more wacky lighthouse-related experiments. Discord: https://discordapp.com/invite/7QbCAGS."
mFsWoyCTVlc,,FULL FACE USING ONLY MY FINGERS (NO BRUSHES) CHALLENGE | RawBeautyKristi,RawBeautyKristi,,2018-03-31T00:00:01Z,,,,,,,,,,Hey guys! today is just a fun laid back not so serious video of me doing my full face using only my fingers makeup challenge! the video I was GOING to film (thats ...
fnFqVlQ61tU,,HE TRIED TO PUT ME IN HIS TRUNK!? | STORYTIME | WEIRD UBER EXPERIENCES,RawBeautyKristi,,2018-01-13T01:00:01Z,,,,,,,,,,"Hey guys, today is a little different - I have lots of stories from my life that I don't just want to live in my head, I have to let them out haha! Today I am gonna talk ..."
YAwBjdtVWpM,,I TRIED FOLLOWING MY VERY FIRST MAKEUP TUTORIAL.. LOL CRINGEEE,RawBeautyKristi,,2018-03-01T01:00:01Z,,,,,,,,,,"Hey guys!!! I did ANOTHER following a makeup tutorial, like I mentioned in my ""I Tried following a Jaclyn Hill Makeup Tutorial"" that I wanted to do! This is my ..."
0rn3lDY16Is,,"REALLY, FASHION NOVA!?! | WHAT I LOVE AND LOATHE | TERRIBLE CUSTOMER SERVICE, BAD POLICIES ETC..",RawBeautyKristi,,2017-12-14T01:00:01Z,,,,,,,,,,"WHATS GOOD, FASHION NOVA?! This is my rant all about the policies and strange gift card and shipping situation with Fashion Nova. While I LOVE a lot of the ..."
hU0xKPHpUZ4,,I TRIED FOLLOWING A JACLYN HILL MAKEUP TUTORIAL | OMG LOL,RawBeautyKristi,,2018-02-20T01:00:01Z,,,,,,,,,,Hey guys! Today I hopped on the trend and tried following a Jaclyn Hill Makeup Tutorial (well 2 of them) I also tell a story of the first time I met her and do a little ...
9q7Vrga2wgU,,HUGE FAIL! | USING EVERY EYESHADOW IN THE PALETTE CHALLENGE | SEPHORA PRO EDITORIAL,RawBeautyKristi,,2018-02-01T01:00:00Z,,,,,,,,,,Hey guys lol.. Todays video was supposed to be really cool and really well done with amazing makeup and such a challenge.. after 12 colors or so my eyes ...
BBy5Ef1P3PQ,,SO EASY! | HOW TO APPLY FALSE EYELASHES | EVERYTHING YOU NEED TO KNOW!,RawBeautyKristi,,2018-02-15T01:00:00Z,,,,,,,,,,Hey guys today is a full video that has been HIGHLY requested for the longest time - this is an IN DEPTH video ALL about how to apply false eyelashes and why ...
j-Hk2LLhUlc,,WORST BEAUTY PRODUCTS OF 2017 | LEAST FAVORITE MAKEUP THIS YEAR,RawBeautyKristi,,2017-12-30T01:00:02Z,,,,,,,,,,Hey guys! today is a collection of what I believe to be the WORST makeup launches/products I tried this year in 2017. This in NO way is saying that the brands ...
-jhyP7TaOGk,,GLAMMING MY SISTER &amp; ANSWERING YOUR QUESTIONS *Cringe lol*,RawBeautyKristi,,2018-06-05T00:00:02Z,,,,,,,,,,Hey guys! Today I glammed my sister for a video and am answering your questions that you guys asked on Twitter - I hope you guys love this video! Foundation ...
w0fa6QMFAA0,,15 MINUTE MAKEUP | GLOWY SKIN &amp; BIG LASHES | GRWM + CHAT,RawBeautyKristi,,2018-04-28T00:00:04Z,,,,,,,,,,Hey guys! Today is just a quick sit down GRWM style video where I show you my QUICK out the door makeup for the last week. I have been wearing makeup ...
LPIJVdQkb1Q,,RokBlok Review- The New Bluetooth &#39;Vinyl Killer&#39;,Techmoan,,2018-01-04T23:07:11Z,,,,,,,,,,**********No I didn't have it at the wrong speed********** 45rpm would sound like crazy chipmunk music - if you want visual confirmation look at 3:42 - 4:00 ...
kdfTuE9XHas,,RetroTech: Recordable Paper - The 3M Sound Page,Techmoan,,2018-04-12T16:01:46Z,,,,,,,,,,"In this video I take a look at a multimedia educational format from the 1970s, the 3M Sound Page (AKA Ricoh Synchrofax) UPDATE I've seen a few comments ..."
